{
  "schema_version": 1,
  "id": "WP-320-agent-installers",
  "title": "Agent installers and session bootstrap",
  "status": "ready",
  "objective": "workctx can detect Codex, Claude Code, and Gemini CLI, generate project-scoped instruction and skill adapters from canonical sources with drift-detecting manifests, report status, repair and uninstall safely, and open a context in a selected agent — all as typed APIs, without touching user credentials.",
  "business_value": "Agent interoperability is a Phase 1 definition-of-done pillar: one canonical rule set serving three agent clients without duplication or drift (risks R-005).",
  "scope": [
    "Implement src/workctx/adapters/agents/: client detection (executables on PATH plus client-native project markers) for codex, claude, and gemini with a typed capability report",
    "Adapter generation from canonical sources per doc-13 and the WP-130 manifest spec (docs/reference/skill-adapters.md + schemas/skill-adapter-manifest.schema.json): generate project-scoped skill copies and instruction bridges into client-native locations (.claude/skills/, .gemini/, .codex/ per the adapter strategy), writing the manifest with canonical sha256 hashes and adapter version",
    "Idempotent install: rerunning produces no changes when sources are unchanged; user-owned files are backed up before modification and never deleted on uninstall",
    "status/repair/uninstall APIs: status reports drift by comparing manifest hashes to canonical sources; repair regenerates only stale files; uninstall removes only manifest-listed generated files",
    "Session bootstrap: an open_context API that launches the selected detected client in a context root (subprocess spawn, no credential handling); failure when the client is missing is a clear unavailable-dependency error",
    "Respect the registry: generated adapters record the skill side-effect classes from .agents/skills/registry.yaml as advisory metadata where the client format allows comments/frontmatter the canonical contract permits",
    "Document the adapter strategy per client in docs/reference/agent-adapters.md"
  ],
  "non_goals": [
    "No MCP configuration generation — that portion is explicitly deferred until WP-330 defines the server identity (D-014); ship the seam (manifest field reserved) and a NOT-IMPLEMENTED status entry",
    "No CLI wiring (lead wires agent detect/install/status/open after integration)",
    "No changes to canonical skills, the frontmatter schema, or the WP-130 manifest schema — you consume them; a manifest-spec gap is a coordination request",
    "No credential reading, storage, or configuration of any kind (hard security boundary)",
    "No new runtime dependencies"
  ],
  "dependencies": [
    "WP-120",
    "WP-130"
  ],
  "base_commit": "55bc43ae7b118f15f131ed04df60e8cbf42f3129",
  "branch": "agent/WP-320-agent-installers",
  "worktree": ".worktrees/WP-320-agent-installers",
  "allowed_paths": [
    "src/workctx/adapters/agents/**",
    "tests/agents_setup/**",
    "docs/reference/agent-adapters.md",
    ".agents/work-orders/WP-320-agent-installers/report.md",
    ".agents/work-orders/WP-320-agent-installers/report.json"
  ],
  "forbidden_paths": [
    "src/workctx/adapters/__init__.py",
    "src/workctx/adapters/filesystem/**",
    "src/workctx/adapters/sqlite/**",
    "src/workctx/domain/**",
    "src/workctx/models/**",
    "src/workctx/presentation/**",
    "src/workctx/retrieval/**",
    "src/workctx/services/**",
    "src/workctx/transactions/**",
    "src/workctx/validation/**",
    "src/workctx/cli.py",
    "src/workctx/resources/**",
    "schemas/**",
    "templates/**",
    ".agents/plan/**",
    ".agents/templates/**",
    ".agents/status/**",
    ".agents/skills/**",
    "AGENTS.md",
    "CLAUDE.md",
    "GEMINI.md",
    "docs/adr/**",
    "pyproject.toml"
  ],
  "required_reading": [
    "AGENTS.md",
    ".agents/plan/initial/13-skill-and-agent-adapter-design.md",
    "docs/reference/skill-adapters.md",
    "schemas/skill-adapter-manifest.schema.json",
    ".agents/skills/registry.yaml",
    ".agents/status/decision-register.md",
    ".agents/work-orders/WP-320-agent-installers/context.md",
    ".agents/work-orders/WP-320-agent-installers/acceptance.md"
  ],
  "context_refs": [
    ".agents/plan/initial/07-test-strategy.md",
    ".agents/plan/initial/09-open-source-distribution.md",
    "docs/adr/0012-mcp-tool-surface-alpha.md"
  ],
  "deliverables": [
    "Agents adapter package: detect, generate, status, repair, uninstall, open — with manifest-driven drift detection and tests in isolated fake home/project directories",
    "docs/reference/agent-adapters.md",
    "Worker report.md and report.json"
  ],
  "acceptance_criteria": [
    "Detection reports each client independently using fake executable discovery (no real client required in tests)",
    "Install generates adapters plus a manifest validating against schemas/skill-adapter-manifest.schema.json; hashes match canonical sources",
    "Editing a canonical skill flips status to stale for exactly the affected files (doc-13 acceptance scenario 3); repair regenerates only those; reinstall is a no-op when clean",
    "Uninstall removes only manifest-listed files; a user-created file in the same directory survives; backups exist for any modified user file",
    "Installing for one client never requires or touches another client's directories (doc-13 scenario 1)",
    "No code path reads or writes credentials, tokens, or user-global auth config (negative test greps generated output and API surface)",
    "open_context spawns the selected detected client (subprocess mocked in tests) and fails clearly when missing",
    "The full validation gate passes"
  ],
  "validation_commands": [
    "uv run ruff check .",
    "uv run ruff format --check .",
    "uv run mypy src",
    "uv run pytest"
  ],
  "security_constraints": [
    "Never read, copy, or reference agent authentication credentials or user-global auth files",
    "Generated files stay scoped to the selected project/context; fictional fixtures only"
  ],
  "stop_conditions": [
    "A gap in the WP-130 manifest spec that requires changing its schema (coordination request)",
    "Any needed change to frozen files, canonical skills, bridges (CLAUDE.md/GEMINI.md/AGENTS.md), or pyproject.toml",
    "A client's native format requiring non-portable canonical-skill changes"
  ],
  "report_paths": {
    "markdown": ".agents/work-orders/WP-320-agent-installers/report.md",
    "json": ".agents/work-orders/WP-320-agent-installers/report.json"
  }
}
