{
  "schema_version": 1,
  "id": "WP-300-transaction-engine",
  "title": "Transaction engine and hash-chained audit ledger",
  "status": "ready",
  "objective": "Multi-entity canonical mutations happen only as validated atomic transactions: typed proposals, preconditions, dry-run, locked staged apply through the WP-200 primitives, hash-chained audit events per ADR 0010, idempotency, projection staleness handling, and recovery — with failure-injection tests.",
  "business_value": "This is the product's central trust mechanism (risk R-001): every ingestion, task, and drafting workflow mutates canonical state exclusively through this engine.",
  "scope": [
    "Implement typed transaction-proposal domain models in src/workctx/domain/transactions.py (TXP id family, base context revision, actor/agent metadata, source references, ordered operations, pre/postconditions) aligned with schemas/transaction-proposal.schema.json, which you own and must tighten from its deliberately loose Wave 1 shape (ADR 0008 positive/negative fixtures; ADR 0011 tiers where relations are inexpressible)",
    "Implement the engine in src/workctx/transactions/: proposal validation (structural via domain models + reference/precondition checks via the WP-220 engine's public API), deterministic dry-run reporting exact intended changes, and apply composing ONLY the WP-200 public primitives (ContextLock with fencing, staged replacement with intent journal, bounded retries) per the ADR 0006 sequence",
    "Implement the ADR 0010 audit ledger: append-only 99_meta/audit/ledger.jsonl with prev_hash/event_hash chain over ADR 0005 canonical serialization, written inside the lock after the replace sequence and before intent finalize; tighten schemas/audit-event.schema.json accordingly (event/prev hash fields, actor, operations, content hashes) with fixtures; provide chain verification and an audit_summary read API",
    "Idempotency: applying the same proposal twice (same proposal id + base revision) is detected and refused with a recoverable conflict; interrupted applies are detectable and completable/rollbackable via the WP-200 recovery inspection API — failure-injection tests required (ADR 0006 acceptance)",
    "Projection staleness: after a committed apply, mark/refresh the SQLite projection through its public rebuild/readiness APIs; a projection failure after canonical commit must not erase the transaction — it reports stale derived state with repair instructions (exit-band 6 semantics at the API level)",
    "Context revision: define and maintain the base-revision token the preconditions check (document the representation in docs/reference/transactions.md); stale-revision proposals are refused with conflict semantics",
    "Expose typed application APIs (validate_proposal, dry_run, apply, audit_summary, verify_ledger) for CLI and MCP wiring by the lead"
  ],
  "non_goals": [
    "No CLI or MCP wiring (lead wires proposal/transaction commands and the ADR 0012 tools)",
    "No artifact/inbox lifecycle (WP-310 composes your apply for archive-after-commit)",
    "No changes to WP-200 primitives — a missing primitive capability is a coordination request to the lead, not a cross-package edit",
    "No external writes of any kind; no LLM involvement (deterministic engine only)",
    "No new runtime dependencies"
  ],
  "dependencies": [
    "WP-200",
    "WP-210",
    "WP-220"
  ],
  "base_commit": "PENDING-WAVE3-BASELINE",
  "branch": "agent/WP-300-transaction-engine",
  "worktree": ".worktrees/WP-300-transaction-engine",
  "allowed_paths": [
    "src/workctx/domain/transactions.py",
    "src/workctx/transactions/**",
    "schemas/transaction-proposal.schema.json",
    "schemas/audit-event.schema.json",
    "tests/transactions/**",
    "docs/reference/transactions.md",
    ".agents/work-orders/WP-300-transaction-engine/report.md",
    ".agents/work-orders/WP-300-transaction-engine/report.json"
  ],
  "forbidden_paths": [
    "src/workctx/domain/__init__.py",
    "src/workctx/domain/ids.py",
    "src/workctx/domain/references.py",
    "src/workctx/domain/locators.py",
    "src/workctx/domain/relations.py",
    "src/workctx/domain/vocabulary.py",
    "src/workctx/domain/observations.py",
    "src/workctx/domain/claims.py",
    "src/workctx/domain/entities.py",
    "src/workctx/domain/tasks.py",
    "src/workctx/domain/artifacts.py",
    "src/workctx/domain/frontmatter.py",
    "src/workctx/adapters/**",
    "src/workctx/models/**",
    "src/workctx/presentation/**",
    "src/workctx/retrieval/**",
    "src/workctx/services/**",
    "src/workctx/validation/**",
    "src/workctx/cli.py",
    "src/workctx/resources/**",
    "schemas/context-pack.schema.json",
    "schemas/reference.schema.json",
    "schemas/source-locator.schema.json",
    "schemas/observation.schema.json",
    "schemas/claim.schema.json",
    "schemas/context.schema.json",
    "schemas/entity.schema.json",
    "schemas/task.schema.json",
    "schemas/artifact-manifest.schema.json",
    "templates/**",
    "tests/domain/**",
    "tests/workspace/**",
    "tests/cli/**",
    "tests/filesystem/**",
    "tests/projections/**",
    "tests/validation_engine/**",
    "tests/retrieval/**",
    ".agents/plan/**",
    ".agents/templates/**",
    ".agents/status/**",
    ".agents/skills/**",
    "AGENTS.md",
    "docs/adr/**",
    "pyproject.toml"
  ],
  "required_reading": [
    "AGENTS.md",
    ".agents/plan/initial/02-architecture.md",
    "docs/adr/0005-canonical-serialization.md",
    "docs/adr/0006-context-locking-and-atomic-writes.md",
    "docs/adr/0009-null-emission-scope.md",
    "docs/adr/0010-audit-ledger-representation.md",
    "docs/adr/0011-schema-expressibility-boundary.md",
    "docs/reference/canonical-store.md",
    ".agents/status/decision-register.md",
    ".agents/work-orders/WP-300-transaction-engine/context.md",
    ".agents/work-orders/WP-300-transaction-engine/acceptance.md"
  ],
  "context_refs": [
    ".agents/plan/initial/07-test-strategy.md",
    "docs/reference/projections.md",
    "docs/reference/validation-diagnostics.md"
  ],
  "deliverables": [
    "Typed proposal models with tightened schemas and ADR 0008/0011 fixtures",
    "Transaction engine (validate, dry-run, apply, idempotency, recovery) with failure-injection tests",
    "Hash-chained audit ledger with verification and summary APIs",
    "docs/reference/transactions.md",
    "Worker report.md and report.json"
  ],
  "acceptance_criteria": [
    "A valid multi-entity proposal applies atomically; an invalid one leaves canonical state byte-identical (verified by tree hash comparison)",
    "Dry-run reports exact intended changes without any write, including staged content hashes",
    "A stale base revision and a duplicate proposal id are each refused with conflict semantics",
    "Injected failure between replaces leaves a detectable intent record; recovery completes or rolls back and the ledger reflects reality (ADR 0006 failure-injection tests, including the takeover-mid-sequence scenario)",
    "The ledger hash chain verifies; tampering with any middle event breaks verification; the first event uses the zero prev_hash",
    "Projection rebuild failure after commit reports stale derived state with repair instructions and does not erase the transaction",
    "Secret-looking values are refused in proposal payloads (doc-08 control) with location-only diagnostics",
    "The full validation gate passes"
  ],
  "validation_commands": [
    "uv run ruff check .",
    "uv run ruff format --check .",
    "uv run mypy src",
    "uv run pytest"
  ],
  "security_constraints": [
    "Fictional fixtures only; the ledger records operations and hashes, never secret values or raw evidence content",
    "All writes go through WP-200 primitives inside the context lock; no direct canonical file writes"
  ],
  "stop_conditions": [
    "A WP-200 primitive gap (raise a coordination request; do not modify the adapter)",
    "Any needed change to frozen files, domain files you do not own, or pyproject.toml",
    "ADR 0006/0010 semantics that cannot be implemented as specified"
  ],
  "report_paths": {
    "markdown": ".agents/work-orders/WP-300-transaction-engine/report.md",
    "json": ".agents/work-orders/WP-300-transaction-engine/report.json"
  }
}
